{
  "schema_version": "1.0",
  "updated_at": "2026-10-23T17:44:00Z",
  "base_commit": "6a2ffd149996b120a614d82652c5805790e54b82",
  "scope": {
    "active_institution": "hit",
    "target_university_count": 39,
    "registry_complete": false,
    "known_organization_nodes": 175,
    "write_model": "single_controller_expected_sha",
    "active_institutions": [
      "hit",
      "zju",
      "thu",
      "pku",
      "sjtu",
      "fdu",
      "nju",
      "ustc",
      "buaa",
      "bit",
      "bnu",
      "cau",
      "muc",
      "nku",
      "dlut",
      "tju",
      "jlu",
      "tongji",
      "ruc",
      "neu",
      "ecnu",
      "seu",
      "xmu",
      "sdu",
      "ouc",
      "whu",
      "hust",
      "hnu",
      "csu",
      "nudt",
      "sysu",
      "scut",
      "scu",
      "uestc",
      "cqu",
      "xjtu",
      "nwpu",
      "nwsuaf",
      "lzu"
    ],
    "active_institution_note": "历史首校兼容字段；并行范围见active_institutions。"
  },
  "tasks": [
    {
      "task_id": "hit-aerospace:roster",
      "institution_id": "hit",
      "organization_id": "hit-aerospace",
      "campus_ids": [
        "hit-harbin"
      ],
      "stage": "roster_enumeration",
      "status": "partial",
      "scope": {
        "description": "公开名录可见条目，不代表完整在职人事名册。 仅限当前已发现的官方分类与分页，不是完整在职人事名册。",
        "claim": "listed_public_scope_only",
        "university_complete": false,
        "source_categories": [
          "师资队伍"
        ]
      },
      "depends_on": [],
      "source_urls": [
        "https://www.hit.edu.cn/11589/list.htm",
        "https://sa.hit.edu.cn/szdw_21460/list.htm"
      ],
      "artifact_paths": [
        "research/coverage-work-queue.json"
      ],
      "review_status": "pending_review",
      "next_action": "按followup_links遍历分类和分页，解析个人名单并去除导航/跨院重复。",
      "next_cursor": null,
      "attempted_at": "2026-10-23T09:53:00Z",
      "last_verified_commit": "de9da4d19d4501bd85e9753c5bcc3b45aa31d369"
    },
    {
      "task_id": "hit-seie:roster",
      "institution_id": "hit",
      "organization_id": "hit-seie",
      "campus_ids": [
        "hit-harbin"
      ],
      "stage": "roster_enumeration",
      "status": "done",
      "scope": {
        "description": "公开名录可见条目，不代表完整在职人事名册。 仅限当前已发现的官方分类与分页，不是完整在职人事名册。",
        "claim": "listed_public_scope_only",
        "university_complete": false,
        "source_categories": [
          "通信工程系",
          "电子工程系",
          "测控工程系",
          "信息工程系",
          "微波工程系"
        ]
      },
      "depends_on": [],
      "source_urls": [
        "https://www.hit.edu.cn/11589/list.htm",
        "https://seie.hit.edu.cn/19281/list.htm",
        "https://seie.hit.edu.cn/19282/list.htm",
        "https://seie.hit.edu.cn/19283/list.htm",
        "https://seie.hit.edu.cn/19284/list.htm",
        "https://seie.hit.edu.cn/19285/list.htm"
      ],
      "artifact_paths": [
        "research/coverage-work-queue.json",
        "data/rosters.json"
      ],
      "review_status": "approved",
      "next_action": "补履历前核验主页身份及冲突链接",
      "next_cursor": null,
      "attempted_at": "2026-10-23T09:53:00Z",
      "last_verified_commit": "de9da4d19d4501bd85e9753c5bcc3b45aa31d369",
      "completion": {
        "checked_at": "2026-10-23T09:53:00Z",
        "evidence_urls": [
          "https://www.hit.edu.cn/11589/list.htm",
          "https://seie.hit.edu.cn/19281/list.htm",
          "https://seie.hit.edu.cn/19282/list.htm",
          "https://seie.hit.edu.cn/19283/list.htm",
          "https://seie.hit.edu.cn/19284/list.htm",
          "https://seie.hit.edu.cn/19285/list.htm"
        ],
        "unresolved_items": [
          "逐人身份、在职状态、履历及可能的未公开人员尚未核实。"
        ],
        "scope_closed": true
      }
    },
    {
      "task_id": "hit-seie:profiles",
      "institution_id": "hit",
      "organization_id": "hit-seie",
      "campus_ids": [
        "hit-harbin"
      ],
      "stage": "profile_research",
      "status": "partial",
      "scope": {
        "description": "165条五系官方名录均已完成首轮逐条查阅：143实质职业史、17稀疏、5仅姓名或扩展身份待核；不等同165身份唯一已证或完整学历。当前可结构化详档157、待完善8，后者含3稀疏与5身份待核。",
        "claim": "listed_public_scope_only",
        "university_complete": false,
        "source_categories": [
          "通信工程系",
          "电子工程系",
          "测控工程系",
          "信息工程系",
          "微波工程系"
        ]
      },
      "depends_on": [
        "hit-seie:roster"
      ],
      "source_urls": [
        "https://www.hit.edu.cn/11589/list.htm",
        "https://seie.hit.edu.cn/19281/list.htm",
        "https://seie.hit.edu.cn/19282/list.htm",
        "https://seie.hit.edu.cn/19283/list.htm",
        "https://seie.hit.edu.cn/19284/list.htm",
        "https://seie.hit.edu.cn/19285/list.htm"
      ],
      "artifact_paths": [
        "data/atlas.json",
        "data/rosters.json",
        "progress/harbin-communication-coverage.json",
        "progress/harbin-electronic-engineering-coverage.json",
        "progress/harbin-measurement-coverage.json",
        "progress/harbin-information-progress.json",
        "progress/harbin-information-coverage.json",
        "progress/harbin-microwave-progress.json",
        "progress/harbin-microwave-coverage.json",
        "progress/harbin-seie-coverage.json"
      ],
      "review_status": "approved",
      "next_action": "全院165条名录首查已完成，继续5身份待核、17稀疏履历及8待核导师关系的定向补证（旧pending_mentors5+新pending_mentor_candidates3），不可提升为已核导师；发布前另行完成导出及浏览器验收。",
      "next_cursor": "seie:first-pass-complete:uncertainty-review",
      "attempted_at": "2026-10-23T13:25:00Z",
      "last_verified_commit": "293677be17c182cfb7c7c42fc777a28a5f53dab6"
    },
    {
      "task_id": "hit-mechanical:roster",
      "institution_id": "hit",
      "organization_id": "hit-mechanical",
      "campus_ids": [
        "hit-harbin"
      ],
      "stage": "roster_enumeration",
      "status": "partial",
      "scope": {
        "description": "公开名录可见条目，不代表完整在职人事名册。 仅限当前已发现的官方分类与分页，不是完整在职人事名册。",
        "claim": "listed_public_scope_only",
        "university_complete": false,
        "source_categories": [
          "师资队伍"
        ]
      },
      "depends_on": [],
      "source_urls": [
        "https://www.hit.edu.cn/11589/list.htm",
        "http://sme.hit.edu.cn/17971/list.htm"
      ],
      "artifact_paths": [
        "research/coverage-work-queue.json"
      ],
      "review_status": "pending_review",
      "next_action": "按followup_links遍历分类和分页，解析个人名单并去除导航/跨院重复。",
      "next_cursor": null,
      "attempted_at": "2026-10-23T09:53:00Z",
      "last_verified_commit": "de9da4d19d4501bd85e9753c5bcc3b45aa31d369"
    },
    {
      "task_id": "hit-materials:roster",
      "institution_id": "hit",
      "organization_id": "hit-materials",
      "campus_ids": [
        "hit-harbin"
      ],
      "stage": "roster_enumeration",
      "status": "partial",
      "scope": {
        "description": "公开名录可见条目，不代表完整在职人事名册。 仅限当前已发现的官方分类与分页，不是完整在职人事名册。",
        "claim": "listed_public_scope_only",
        "university_complete": false,
        "source_categories": [
          "师资队伍"
        ]
      },
      "depends_on": [],
      "source_urls": [
        "https://www.hit.edu.cn/11589/list.htm",
        "http://mse.hit.edu.cn/16898/list.htm"
      ],
      "artifact_paths": [
        "research/coverage-work-queue.json"
      ],
      "review_status": "pending_review",
      "next_action": "按followup_links遍历分类和分页，解析个人名单并去除导航/跨院重复。",
      "next_cursor": null,
      "attempted_at": "2026-10-23T09:53:00Z",
      "last_verified_commit": "de9da4d19d4501bd85e9753c5bcc3b45aa31d369"
    },
    {
      "task_id": "hit-energy:roster",
      "institution_id": "hit",
      "organization_id": "hit-energy",
      "campus_ids": [
        "hit-harbin"
      ],
      "stage": "roster_enumeration",
      "status": "done",
      "scope": {
        "description": "本批官方页面可见分类观察枚举完成，不是唯一人数或完整在职名册。",
        "claim": "listed_public_scope_only",
        "university_complete": false,
        "source_categories": [
          "航空发动机研究所",
          "推进理论与技术研究所",
          "碳中和能源技术研究所",
          "航空航天热物理研究所",
          "先进动力技术研究所",
          "动力机械振动与噪声控制技术研究所",
          "流体机械及工程研究所",
          "能源与环境工程研究所",
          "核科学与技术研究所",
          "空间能源技术研究所",
          "能源动力实验教学中心"
        ]
      },
      "depends_on": [],
      "source_urls": [
        "https://www.hit.edu.cn/11589/list.htm",
        "https://power.hit.edu.cn/5705/list.htm",
        "https://power.hit.edu.cn/5735/list.htm",
        "https://power.hit.edu.cn/19202/list.htm",
        "http://power.hit.edu.cn/19202/list.htm"
      ],
      "artifact_paths": [
        "data/rosters.json"
      ],
      "review_status": "approved",
      "next_action": "核对逐人身份与履历，保留历史页面时效和候选冲突。",
      "next_cursor": null,
      "attempted_at": "2026-10-23T10:10:00Z",
      "last_verified_commit": "de9da4d19d4501bd85e9753c5bcc3b45aa31d369",
      "completion": {
        "checked_at": "2026-10-23T10:10:00Z",
        "evidence_urls": [
          "https://power.hit.edu.cn/5735/list.htm"
        ],
        "unresolved_items": [
          "逐人身份、当前任职、履历与候选重复待核实；旧页面可能滞后。"
        ],
        "scope_closed": true
      }
    },
    {
      "task_id": "hit-electrical:roster",
      "institution_id": "hit",
      "organization_id": "hit-electrical",
      "campus_ids": [
        "hit-harbin"
      ],
      "stage": "roster_enumeration",
      "status": "partial",
      "scope": {
        "description": "公开名录可见条目，不代表完整在职人事名册。 仅限当前已发现的官方分类与分页，不是完整在职人事名册。",
        "claim": "listed_public_scope_only",
        "university_complete": false,
        "source_categories": [
          "师资队伍",
          "专任教师队伍",
          "实验教师队伍",
          "兼职教师队伍"
        ]
      },
      "depends_on": [],
      "source_urls": [
        "https://www.hit.edu.cn/11589/list.htm",
        "http://hitee.hit.edu.cn/17036/list.htm",
        "https://hitee.hit.edu.cn/17037/list.htm",
        "https://hitee.hit.edu.cn/17038/list.htm",
        "https://hitee.hit.edu.cn/17039/list.htm"
      ],
      "artifact_paths": [